{
 "$schema": "https://json-schema.org/draft/2020-12/schema",
 "$id": "https://tantrafiles.xyz/schema/routine.json",
 "title": "Routine: practices in sequence, run end to end by the hands-off player (sit/)",
 "description": "PRACTICE-ENGINE §1 Routine layer. Each item is a built practice (practices/<id>.json) fitted to its minutes by sit/session.mjs fitPractice: longer = the practice's own rounds then silent open sitting (rule open-sitting); shorter = beginner form, then optional stages dropped. Never a hold: practices with retention are refused.",
 "type": "object",
 "required": ["type", "schema_version", "id", "name", "items"],
 "properties": {
  "type": { "const": "routine" },
  "schema_version": { "const": 1 },
  "id": { "type": "string", "pattern": "^[a-z0-9-]+$" },
  "name": { "type": "string" },
  "summary": { "type": "string" },
  "items": { "type": "array", "minItems": 1, "items": { "type": "object", "required": ["practice"], "additionalProperties": false, "properties": {
   "practice": { "type": "string", "description": "practice id (engine/practices/<id>.json)" },
   "label": { "type": "string" },
   "minutes": { "type": "number", "exclusiveMinimum": 0, "maximum": 180 },
   "beginner": { "type": "boolean" },
   "skip_stages": { "type": "array", "items": { "type": "string" } },
   "only_stages": { "type": "array", "items": { "type": "string" }, "description": "run only these stages (e.g. the settling steps of a longer method)" }
  } } },
  "transition": { "type": "object", "properties": { "sound": { "enum": ["chime", "bowl", "none"] }, "note": { "type": "string" } } },
  "meta": { "type": "object" }
 }
}
